{
  "schemaVersion": "1.0.0",
  "governanceFormatVersion": "2.0.0",
  "contractId": "replace-with-contract-id",
  "planVersion": "0.0.0",
  "planTitle": "replace-with-plan-title",
  "currentPhaseId": "PHASE-ID",
  "phases": [
    {
      "phaseId": "PHASE-ID",
      "title": "replace-with-phase-title",
      "status": "PLAN_DRAFT"
    }
  ],
  "authoritySources": [
    "replace-with-authority-source"
  ],
  "roleBindings": {
    "requirementAuthority": "user and named authority documents",
    "planner": "replace-with-planner",
    "implementer": "replace-with-implementer",
    "automaticVerifier": "protected verifier when installed",
    "independentReviewer": "NOT_REQUESTED unless user explicitly requests review",
    "manualReviewer": "user-approved human reviewer when required",
    "finalAcceptanceAuthority": "user"
  },
  "status": {
    "plan_state": "PLAN_DRAFT",
    "implementation_state": "NOT_STARTED",
    "executor_checks": "NOT_RUN",
    "independent_review": "NOT_REQUESTED",
    "user_acceptance": "PENDING"
  },
  "requirements": [
    {
      "requirementId": "REQ-001",
      "authoritySource": "replace-with-authority-source",
      "classification": "IN_SCOPE",
      "observableRequirement": "replace-with-observable-requirement",
      "dependencies": [],
      "status": {
        "plan_state": "PLAN_DRAFT",
        "implementation_state": "NOT_STARTED",
        "executor_checks": "NOT_RUN",
        "independent_review": "NOT_REQUESTED",
        "user_acceptance": "PENDING"
      }
    }
  ]
}
