{
  "schemaVersion": "1.0.0",
  "contractId": "hosted-sandbox-verifier-setup-v1",
  "planVersion": "1.0.0",
  "planTitle": "Hosted Sandbox Verifier Setup",
  "authoritySources": [
    "User command on 2026-08-25 to apply Faz 0 of the Hosted Sandbox integrity plan",
    "AGENTS.md",
    "docs/execution-governance/EXECUTION_ASSURANCE_PROTOCOL.md",
    "docs/execution-governance/LIFECYCLE_AND_OPTIONAL_REVIEW_FLOW.md",
    "docs/execution-governance/MANU_AI_PLAN_IMPLEMENTATION_ASSURANCE_INTEGRATION_PLAN.md"
  ],
  "roleBindings": {
    "requirementAuthority": "user and named authority documents",
    "planner": "Cursor Grok after user Faz 0 command",
    "implementer": "Cursor Grok after user Faz 0 command",
    "automaticVerifier": "app/scripts/verify-hosted-sandbox-contracts.mjs and governance-cli",
    "independentReviewer": "NOT_REQUESTED unless user explicitly requests review",
    "manualReviewer": "user-approved human reviewer when required",
    "finalAcceptanceAuthority": "user"
  },
  "status": {
    "plan_state": "READY_FOR_IMPLEMENTATION",
    "implementation_state": "NOT_STARTED",
    "executor_checks": "NOT_RUN",
    "independent_review": "NOT_REQUESTED",
    "user_acceptance": "PENDING"
  },
  "requirements": [
    {
      "requirementId": "HS-GOV-VS-001",
      "authoritySource": "Hosted Sandbox plan Faz 0",
      "classification": "IN_SCOPE",
      "observableRequirement": "Verifier-setup and main Hosted Sandbox plan packages exist with plan.md, contract.json, scope.json, and acceptance.json.",
      "dependencies": [],
      "status": {
        "plan_state": "READY_FOR_IMPLEMENTATION",
        "implementation_state": "NOT_STARTED",
        "executor_checks": "NOT_RUN",
        "independent_review": "NOT_REQUESTED",
        "user_acceptance": "PENDING"
      }
    },
    {
      "requirementId": "HS-GOV-VS-002",
      "authoritySource": "Hosted Sandbox plan Faz 0",
      "classification": "IN_SCOPE",
      "observableRequirement": "Protected verifier binds Git SHA, migration fingerprint, required API contract files, and plan-package presence, and writes a freshness-bound runtime artifact.",
      "dependencies": ["HS-GOV-VS-001"],
      "status": {
        "plan_state": "READY_FOR_IMPLEMENTATION",
        "implementation_state": "NOT_STARTED",
        "executor_checks": "NOT_RUN",
        "independent_review": "NOT_REQUESTED",
        "user_acceptance": "PENDING"
      }
    },
    {
      "requirementId": "HS-GOV-VS-003",
      "authoritySource": "Hosted Sandbox plan Faz 0",
      "classification": "IN_SCOPE",
      "observableRequirement": "Verifier negative controls fail closed for wrong SHA, missing migration set, demo-tenant fixture, and unauthorized diff.",
      "dependencies": ["HS-GOV-VS-002"],
      "status": {
        "plan_state": "READY_FOR_IMPLEMENTATION",
        "implementation_state": "NOT_STARTED",
        "executor_checks": "NOT_RUN",
        "independent_review": "NOT_REQUESTED",
        "user_acceptance": "PENDING"
      }
    },
    {
      "requirementId": "HS-GOV-VS-004",
      "authoritySource": "Hosted Sandbox plan Faz 0",
      "classification": "IN_SCOPE",
      "observableRequirement": "Governance doctor, validate, and red-team harness PASS without changing protected governance surfaces.",
      "dependencies": ["HS-GOV-VS-001"],
      "status": {
        "plan_state": "READY_FOR_IMPLEMENTATION",
        "implementation_state": "NOT_STARTED",
        "executor_checks": "NOT_RUN",
        "independent_review": "NOT_REQUESTED",
        "user_acceptance": "PENDING"
      }
    },
    {
      "requirementId": "HS-GOV-VS-005",
      "authoritySource": "Hosted Sandbox plan Faz 0",
      "classification": "IN_SCOPE",
      "observableRequirement": "Phase 0 evidence and HANDOFF record verifier setup, remaining lock-commit gap, and that production remains NO-GO.",
      "dependencies": ["HS-GOV-VS-002", "HS-GOV-VS-003", "HS-GOV-VS-004"],
      "status": {
        "plan_state": "READY_FOR_IMPLEMENTATION",
        "implementation_state": "NOT_STARTED",
        "executor_checks": "NOT_RUN",
        "independent_review": "NOT_REQUESTED",
        "user_acceptance": "PENDING"
      }
    }
  ]
}
